{"corpus":{"corpus_digest":"98dfb9c1ce147613e5490bc85670998cd3e46b106a7b691d895befd5ddd42419","corpus_id":"proof-dormancy-nonactivation-exact-binding","corpus_version":"1.0.0","executable_control_count":18},"exact_binding_declaration_digest":"410cfe9c528f88b38adbaf188fa6353f158c38fb8816022e219cc34c7f047416","profile_digest":"34fe6942fc06d74abb0faef0f4488c81b56d2f165f83ceb7ca9595aef79ff69c","profile_id":"proof.dormancy.nonactivation","profile_version":"1.0.0","result":{"failed_control_ids":[],"passed_control_ids":["activation-trace-substituted","context-admission_digest-mismatch","context-contract_digest-mismatch","context-evaluation_input_digest-mismatch","context-exact_binding_certification_digest-mismatch","context-exact_binding_declaration_digest-mismatch","context-profile_digest-mismatch","context-vocabulary_complete_digest-mismatch","context-vocabulary_version-mismatch","default-config-substituted","distinct-artifact-paths-equal-bytes","graph-node-added","graph-node-omitted","graph-subject-substituted","positive-compatibility-codec","positive-feature-gated-scheduler","positive-plugin-registry","source-descriptor-reused"],"status":"passed"},"schema_version":"controlled-contract-exact-binding-certification-result.v1"}
