{"corpus":{"corpus_digest":"e26257a1c48277d183cdd4c97f8886fbd0a7ede1febeb4ab16f6a88ba26c13ba","corpus_id":"proof-policy-boundary-exact-binding","corpus_version":"1.0.0","executable_control_count":22,"executable_module":"packages/controlled-contract/test/proof-packs/bounded-policy-v1-exact-corpus.mjs","executable_module_digest":"6db4ff45d50df850e0669db818e958fcbdf24a2c0556d06d23c4b8a2997db6ce"},"exact_binding_declaration_digest":"74b8db6d02b5e3a402e5e0711d019c62210734dc5933b1f9a993247cc8077b08","profile_digest":"bdc2cbedef2d036489a4f84725d6680fafffb52563925bccc8fc6ce1f5427794","profile_id":"proof.policy.declared-boundary-record-consistency","profile_version":"2.0.0","result":{"failed_control_ids":[],"passed_control_ids":["admission-substitution","association-substitution","certification-substitution","declaration-source-order-substitution","declaration-substitution","evaluation-input-substitution","positive-exact-binding","profile-association-binding-omission","profile-cardinality-weakening","profile-complete-population-omission","profile-falsifier-omission","profile-mechanism-omission","profile-relation-omission","profile-satisfaction-weakening","profile-stage-weakening","profile-substitution","profile-verification-method-weakening","projected-evaluation-opt-in-removal","projection-result-substitution","result-as-source-splice","source-role-swap","source-substitution"],"status":"passed"},"schema_version":"controlled-contract-exact-binding-certification-result.v1"}
