{"corpus":{"corpus_digest":"3fbd61a0cbb1b02657696421fe89cdd9d866d6301d73f3d2f4de968aefc887a1","corpus_id":"deterministic-lexicographic-conformance-exact-binding","corpus_version":"1.0.0","executable_control_count":20},"exact_binding_declaration_digest":"f7d95a991334168e60f7dd47a56b065c3f30bcc55af9fe6ec03e0ac2b3d78ff5","profile_digest":"26de4857cff1acf69084e4e89d5785771e97df5b98c50daa2163cb1a3218059c","profile_id":"proof.ordering.lexicographic-conformance","profile_version":"1.0.0","result":{"failed_control_ids":[],"passed_control_ids":["boolean-numeric-unicode-positive","comparator-evidence-missing-refused","conformance-report-fabrication-refused","conformance-report-rebinding-refused","declared-population-duplicate-refused","declared-population-omission-refused","declared-population-substitution-refused","distinct-source-descriptor-alias-refused","input-snapshot-missing-refused","numeric-unicode-positive","ordering-policy-missing-refused","policy-population-duplicate-refused","policy-population-omission-refused","policy-population-substitution-refused","result-population-duplicate-refused","result-population-omission-refused","result-population-substitution-refused","result-snapshot-missing-refused","source-result-shape-swap-refused","timestamp-integer-positive"],"status":"passed"},"schema_version":"controlled-contract-exact-binding-certification-result.v1"}
