{"corpus":{"corpus_digest":"fd6216a2d0c3ab984972bd8ce64f6e8d4d6313a7c133761066b9538e8baac062","corpus_id":"behavioral-preservation-exact-binding","corpus_version":"1.0.0","executable_control_count":12},"exact_binding_declaration_digest":"ff26a984d7316d0dc1eed461f8dc3ee88eaf840da1110c513d81116e7c0ef0a7","profile_digest":"4056a01541f7f6c32d4de3ed9c6a257ff9adbfdc2ee153c7032dba7aa0655294","profile_id":"proof.compatibility.behavioral-preservation","profile_version":"1.0.0","result":{"failed_control_ids":[],"passed_control_ids":["artifact-bytes-match","artifact-bytes-mismatch-rejected","contract-context-splice-rejected","declaration-digest-stale-rejected","deterministic-source-order","evaluation-context-splice-rejected","extra-source-invalid","missing-baseline-indeterminate","missing-candidate-indeterminate","noncanonical-declaration-rejected","role-coverage-swap-rejected","source-descriptors-distinct"],"status":"passed"},"schema_version":"controlled-contract-exact-binding-certification-result.v1"}
